{
  "schema_version": "ghostlight.reviewed_mutation.v0",
  "mutation_id": "pallas-training-loop-v0.turn-03.mutation",
  "review_status": "accepted_as_draft",
  "scene_loop_id": "pallas-training-loop-v0",
  "turn_id": "turn-03",
  "prior_state_refs": [
    "examples/training-loops/pallas-training-loop-v0/pallas-training-loop-v0.initial-state.json",
    "examples/training-loops/pallas-training-loop-v0/pallas-training-loop-v0.turn-02.mutation.json"
  ],
  "event_ref": "examples/training-loops/pallas-training-loop-v0/pallas-training-loop-v0.turn-03.event.json",
  "responder_output_ref": "experiments/responder-packets/pallas-training-loop-v0.turn-03.lio-vale.packet.capture.json",
  "appraisal_refs": [
    "examples/training-loops/pallas-training-loop-v0/pallas-training-loop-v0.turn-03.appraisal.nara_7.json",
    "examples/training-loops/pallas-training-loop-v0/pallas-training-loop-v0.turn-03.appraisal.ilya_marne.json",
    "examples/training-loops/pallas-training-loop-v0/pallas-training-loop-v0.turn-03.appraisal.orrin_dax.json"
  ],
  "accepted_deltas": [
    {
      "delta_id": "turn-03.accepted.1",
      "target_ref": "scene.maintenance_log",
      "delta_type": "world_fact_update",
      "summary": "False-Seam pattern is directed into the formal maintenance log.",
      "authority": "manual_review",
      "status": "accepted",
      "rationale": "Accepted because it follows directly from observable event plus participant appraisal."
    },
    {
      "delta_id": "turn-03.accepted.2",
      "target_ref": "relationship.nara_to_lio",
      "delta_type": "relationship_update",
      "summary": "Nara has reason to trust Lio slightly more with substance of refusal.",
      "authority": "manual_review",
      "status": "accepted",
      "rationale": "Accepted because it follows directly from observable event plus participant appraisal."
    },
    {
      "delta_id": "turn-03.accepted.3",
      "target_ref": "scene.strike_cohesion",
      "delta_type": "world_fact_update",
      "summary": "Refusal becomes more repeatable because it enters shared record without immediate collapse.",
      "authority": "manual_review",
      "status": "accepted",
      "rationale": "Accepted because it follows directly from observable event plus participant appraisal."
    }
  ],
  "rejected_deltas": [
    {
      "delta_id": "turn-03.rejected.omniscient-intent",
      "target_ref": "participant.private_state",
      "delta_type": "blocked_hidden_state_write",
      "summary": "Do not write actor private_interpretation into other participants as known fact.",
      "authority": "blocked",
      "status": "rejected",
      "rationale": "Listener appraisals must infer from observable action only."
    }
  ],
  "deferred_deltas": [
    {
      "delta_id": "turn-03.deferred.branch-compile",
      "target_ref": "branch.compiler",
      "delta_type": "branch_compile",
      "summary": "Do not compile branches until more accepted turns exist.",
      "authority": "coordinator_review",
      "status": "deferred",
      "rationale": "Pilot gate is receipt-chain validation, not IF compilation."
    }
  ],
  "authority_notes": "Manual coordinator review applies deltas from event and appraisal receipts. Prior mutation refs are chained explicitly so each turn can be reconstructed from the reviewed state available at projection time.",
  "post_state_summary": "False-Seam pattern is directed into the formal maintenance log.; Nara has reason to trust Lio slightly more with substance of refusal.; Refusal becomes more repeatable because it enters shared record without immediate collapse.",
  "review": {
    "reviewer": "Codex coordinator",
    "accepted_for_training": true,
    "rationale": "Mutation receipt records prior refs, accepted/rejected/deferred deltas, authority, and rationale.",
    "failure_labels": []
  }
}
