{
  "schema_version": "ghostlight.reviewed_mutation.v0",
  "mutation_id": "lucent-hostage-feed-v0.turn-12.mutation",
  "review_status": "accepted_as_draft",
  "scene_loop_id": "lucent-hostage-feed-v0",
  "turn_id": "turn-12",
  "prior_state_refs": [
    "examples/training-loops/lucent-hostage-feed-v0/lucent-hostage-feed-v0.turn-11.mutation.json"
  ],
  "event_ref": "examples/training-loops/lucent-hostage-feed-v0/lucent-hostage-feed-v0.turn-12.event.json",
  "responder_output_ref": "experiments/responder-packets/lucent-hostage-feed-v0.turn-12.juno-ark.packet.capture.json",
  "appraisal_refs": [
    "examples/training-loops/lucent-hostage-feed-v0/lucent-hostage-feed-v0.turn-12.appraisal.sol_vant.json",
    "examples/training-loops/lucent-hostage-feed-v0/lucent-hostage-feed-v0.turn-12.appraisal.mara_quell.json",
    "examples/training-loops/lucent-hostage-feed-v0/lucent-hostage-feed-v0.turn-12.appraisal.feed_ops_chorus.json"
  ],
  "accepted_deltas": [
    {
      "delta_id": "turn-12.accepted.1",
      "target_ref": "scene.lucent-hostage-feed-v0.1",
      "delta_type": "world_fact_update",
      "summary": "Juno begins a slow, visible move toward the elevator gate safe line.",
      "authority": "manual_review",
      "status": "accepted",
      "rationale": "Accepted because it follows directly from observable event plus participant appraisal."
    },
    {
      "delta_id": "turn-12.accepted.2",
      "target_ref": "scene.lucent-hostage-feed-v0.2",
      "delta_type": "world_fact_update",
      "summary": "Juno remains not directly held; Sol's empty hands and the gap between them stay visible.",
      "authority": "manual_review",
      "status": "accepted",
      "rationale": "Accepted because it follows directly from observable event plus participant appraisal."
    },
    {
      "delta_id": "turn-12.accepted.3",
      "target_ref": "scene.lucent-hostage-feed-v0.3",
      "delta_type": "world_fact_update",
      "summary": "Hostage-release phase can progress if security continues to delay breach.",
      "authority": "manual_review",
      "status": "accepted",
      "rationale": "Accepted because it follows directly from observable event plus participant appraisal."
    },
    {
      "delta_id": "turn-12.accepted.4",
      "target_ref": "scene.lucent-hostage-feed-v0.4",
      "delta_type": "world_fact_update",
      "summary": "Juno verbally frames her movement as nonviolent clearance, not authorization for intervention.",
      "authority": "manual_review",
      "status": "accepted",
      "rationale": "Accepted because it follows directly from observable event plus participant appraisal."
    }
  ],
  "rejected_deltas": [
    {
      "delta_id": "turn-12.rejected.private-intent",
      "target_ref": "participant.private_state",
      "delta_type": "blocked_hidden_state_write",
      "summary": "Do not write actor private_interpretation into other participants as known fact.",
      "authority": "blocked",
      "status": "rejected",
      "rationale": "Listener appraisals must infer from observable action only."
    }
  ],
  "deferred_deltas": [
    {
      "delta_id": "turn-12.deferred.branch-compile",
      "target_ref": "branch.compiler",
      "delta_type": "branch_compile",
      "summary": "Do not compile branches from this linear release loop yet.",
      "authority": "coordinator_review",
      "status": "deferred",
      "rationale": "Current gate is stateful receipt-chain validation, not IF compilation."
    }
  ],
  "authority_notes": "Manual coordinator review applies deltas from event and appraisal receipts. Future trained organs should learn this state-mutation shape.",
  "post_state_summary": "Juno begins a slow, visible move toward the elevator gate safe line.; Juno remains not directly held; Sol's empty hands and the gap between them stay visible.; Hostage-release phase can progress if security continues to delay breach.",
  "review": {
    "reviewer": "Codex coordinator",
    "accepted_for_training": true,
    "rationale": "Mutation receipt records prior refs, accepted/rejected/deferred deltas, authority, and rationale.",
    "failure_labels": []
  }
}
