{
  "schema_version": "ghostlight.reviewed_mutation.v0",
  "mutation_id": "lucent-hostage-feed-v0.turn-19.mutation",
  "review_status": "accepted_as_draft",
  "scene_loop_id": "lucent-hostage-feed-v0",
  "turn_id": "turn-19",
  "prior_state_refs": [
    "examples/training-loops/lucent-hostage-feed-v0/lucent-hostage-feed-v0.turn-18.mutation.json"
  ],
  "event_ref": "examples/training-loops/lucent-hostage-feed-v0/lucent-hostage-feed-v0.turn-19.event.json",
  "responder_output_ref": "experiments/responder-packets/lucent-hostage-feed-v0.turn-19.feed-ops-chorus.packet.capture.json",
  "appraisal_refs": [
    "examples/training-loops/lucent-hostage-feed-v0/lucent-hostage-feed-v0.turn-19.appraisal.sol_vant.json",
    "examples/training-loops/lucent-hostage-feed-v0/lucent-hostage-feed-v0.turn-19.appraisal.juno_ark.json",
    "examples/training-loops/lucent-hostage-feed-v0/lucent-hostage-feed-v0.turn-19.appraisal.mara_quell.json"
  ],
  "accepted_deltas": [
    {
      "delta_id": "turn-19.accepted.1",
      "target_ref": "scene.lucent-hostage-feed-v0.1",
      "delta_type": "world_fact_update",
      "summary": "Juno safe-line crossing confirmed on visible feed.",
      "authority": "manual_review",
      "status": "accepted",
      "rationale": "Accepted because it follows directly from observable event plus participant appraisal."
    },
    {
      "delta_id": "turn-19.accepted.2",
      "target_ref": "scene.lucent-hostage-feed-v0.2",
      "delta_type": "world_fact_update",
      "summary": "Juno no longer treated as active hostage while holding position on marked line with hands visible.",
      "authority": "manual_review",
      "status": "accepted",
      "rationale": "Accepted because it follows directly from observable event plus participant appraisal."
    },
    {
      "delta_id": "turn-19.accepted.3",
      "target_ref": "scene.lucent-hostage-feed-v0.3",
      "delta_type": "world_fact_update",
      "summary": "Security hold remains active; no advance authorized from service collars or drone apertures.",
      "authority": "manual_review",
      "status": "accepted",
      "rationale": "Accepted because it follows directly from observable event plus participant appraisal."
    },
    {
      "delta_id": "turn-19.accepted.4",
      "target_ref": "scene.lucent-hostage-feed-v0.4",
      "delta_type": "world_fact_update",
      "summary": "Evidence export remains locked and preserved pending external receipt verification.",
      "authority": "manual_review",
      "status": "accepted",
      "rationale": "Accepted because it follows directly from observable event plus participant appraisal."
    }
  ],
  "rejected_deltas": [
    {
      "delta_id": "turn-19.rejected.private-intent",
      "target_ref": "participant.private_state",
      "delta_type": "blocked_hidden_state_write",
      "summary": "Do not write actor private_interpretation into other participants as known fact.",
      "authority": "blocked",
      "status": "rejected",
      "rationale": "Listener appraisals must infer from observable action only."
    }
  ],
  "deferred_deltas": [
    {
      "delta_id": "turn-19.deferred.branch-compile",
      "target_ref": "branch.compiler",
      "delta_type": "branch_compile",
      "summary": "Do not compile branches from this linear release loop yet.",
      "authority": "coordinator_review",
      "status": "deferred",
      "rationale": "Current gate is stateful receipt-chain validation, not IF compilation."
    }
  ],
  "authority_notes": "Manual coordinator review applies deltas from event and appraisal receipts. Future trained organs should learn this state-mutation shape.",
  "post_state_summary": "Juno safe-line crossing confirmed on visible feed.; Juno no longer treated as active hostage while holding position on marked line with hands visible.; Security hold remains active; no advance authorized from service collars or drone apertures.",
  "review": {
    "reviewer": "Codex coordinator",
    "accepted_for_training": true,
    "rationale": "Mutation receipt records prior refs, accepted/rejected/deferred deltas, authority, and rationale.",
    "failure_labels": []
  }
}
