{
  "schema_version": "ghostlight.reviewed_mutation.v0",
  "mutation_id": "lucent-hostage-feed-v0.turn-16.mutation",
  "review_status": "accepted_as_draft",
  "scene_loop_id": "lucent-hostage-feed-v0",
  "turn_id": "turn-16",
  "prior_state_refs": [
    "examples/training-loops/lucent-hostage-feed-v0/lucent-hostage-feed-v0.turn-15.mutation.json"
  ],
  "event_ref": "examples/training-loops/lucent-hostage-feed-v0/lucent-hostage-feed-v0.turn-16.event.json",
  "responder_output_ref": "experiments/responder-packets/lucent-hostage-feed-v0.turn-16.juno-ark.packet.capture.json",
  "appraisal_refs": [
    "examples/training-loops/lucent-hostage-feed-v0/lucent-hostage-feed-v0.turn-16.appraisal.sol_vant.json",
    "examples/training-loops/lucent-hostage-feed-v0/lucent-hostage-feed-v0.turn-16.appraisal.mara_quell.json",
    "examples/training-loops/lucent-hostage-feed-v0/lucent-hostage-feed-v0.turn-16.appraisal.feed_ops_chorus.json"
  ],
  "accepted_deltas": [
    {
      "delta_id": "turn-16.accepted.1",
      "target_ref": "scene.lucent-hostage-feed-v0.1",
      "delta_type": "world_fact_update",
      "summary": "Juno continues toward the safe line with no visible threat gesture.",
      "authority": "manual_review",
      "status": "accepted",
      "rationale": "Accepted because it follows directly from observable event plus participant appraisal."
    },
    {
      "delta_id": "turn-16.accepted.2",
      "target_ref": "scene.lucent-hostage-feed-v0.2",
      "delta_type": "world_fact_update",
      "summary": "Juno keeps hands visible and does not approach Sol or security.",
      "authority": "manual_review",
      "status": "accepted",
      "rationale": "Accepted because it follows directly from observable event plus participant appraisal."
    },
    {
      "delta_id": "turn-16.accepted.3",
      "target_ref": "scene.lucent-hostage-feed-v0.3",
      "delta_type": "world_fact_update",
      "summary": "Crossing remains eligible to resolve if she reaches the marked safe line without interruption.",
      "authority": "manual_review",
      "status": "accepted",
      "rationale": "Accepted because it follows directly from observable event plus participant appraisal."
    },
    {
      "delta_id": "turn-16.accepted.4",
      "target_ref": "scene.lucent-hostage-feed-v0.4",
      "delta_type": "world_fact_update",
      "summary": "Feed state remains evidence-focused rather than celebration or breach spectacle.",
      "authority": "manual_review",
      "status": "accepted",
      "rationale": "Accepted because it follows directly from observable event plus participant appraisal."
    }
  ],
  "rejected_deltas": [
    {
      "delta_id": "turn-16.rejected.private-intent",
      "target_ref": "participant.private_state",
      "delta_type": "blocked_hidden_state_write",
      "summary": "Do not write actor private_interpretation into other participants as known fact.",
      "authority": "blocked",
      "status": "rejected",
      "rationale": "Listener appraisals must infer from observable action only."
    }
  ],
  "deferred_deltas": [
    {
      "delta_id": "turn-16.deferred.branch-compile",
      "target_ref": "branch.compiler",
      "delta_type": "branch_compile",
      "summary": "Do not compile branches from this linear release loop yet.",
      "authority": "coordinator_review",
      "status": "deferred",
      "rationale": "Current gate is stateful receipt-chain validation, not IF compilation."
    }
  ],
  "authority_notes": "Manual coordinator review applies deltas from event and appraisal receipts. Future trained organs should learn this state-mutation shape.",
  "post_state_summary": "Juno continues toward the safe line with no visible threat gesture.; Juno keeps hands visible and does not approach Sol or security.; Crossing remains eligible to resolve if she reaches the marked safe line without interruption.",
  "review": {
    "reviewer": "Codex coordinator",
    "accepted_for_training": true,
    "rationale": "Mutation receipt records prior refs, accepted/rejected/deferred deltas, authority, and rationale.",
    "failure_labels": []
  }
}
